lsusb on ubuntu live when connected: 

// all devices connected: 
ubuntu@ubuntu:~$ lsusb
Bus 001 Device 001: ID 1d6b:0002 Linux Foundation 2.0 root hub
Bus 001 Device 002: ID 0bda:5411 Realtek Semiconductor Corp. RTS5411 Hub
Bus 001 Device 003: ID 0e8d:0616 MediaTek Inc. Wireless_Device
Bus 001 Device 004: ID 2109:2211 VIA Labs, Inc. USB2.0 Hub             
Bus 001 Device 005: ID 048d:5702 Integrated Technology Express, Inc. RGB LED Controller
Bus 001 Device 007: ID 1462:3fa4 Micro Star International MSI Gaming Controller
Bus 001 Device 011: ID 05e3:0610 Genesys Logic, Inc. Hub
Bus 001 Device 012: ID 046d:c52b Logitech, Inc. Unifying Receiver
Bus 001 Device 013: ID 4b42:0011 KBDFANS TIGER80
Bus 001 Device 014: ID 0b0e:0e41 GN Netcom Jabra Evolve2 40
Bus 002 Device 001: ID 1d6b:0003 Linux Foundation 3.0 root hub
Bus 002 Device 002: ID 0781:5595 SanDisk Corp.  SanDisk 3.2Gen1
Bus 002 Device 003: ID 0bda:0411 Realtek Semiconductor Corp. Hub
Bus 002 Device 005: ID 05e3:0626 Genesys Logic, Inc. Hub
Bus 003 Device 001: ID 1d6b:0002 Linux Foundation 2.0 root hub
Bus 004 Device 001: ID 1d6b:0003 Linux Foundation 3.0 root hub
Bus 005 Device 001: ID 1d6b:0002 Linux Foundation 2.0 root hub
Bus 006 Device 001: ID 1d6b:0003 Linux Foundation 3.0 root hub
Bus 007 Device 001: ID 1d6b:0002 Linux Foundation 2.0 root hub
Bus 007 Device 002: ID 05e3:0608 Genesys Logic, Inc. Hub
Bus 008 Device 001: ID 1d6b:0003 Linux Foundation 3.0 root hub

// removed monitor: 
ubuntu@ubuntu:~$ lsusb
Bus 001 Device 001: ID 1d6b:0002 Linux Foundation 2.0 root hub
Bus 001 Device 002: ID 0bda:5411 Realtek Semiconductor Corp. RTS5411 Hub
Bus 001 Device 003: ID 0e8d:0616 MediaTek Inc. Wireless_Device
Bus 001 Device 005: ID 048d:5702 Integrated Technology Express, Inc. RGB LED Controller
Bus 001 Device 011: ID 05e3:0610 Genesys Logic, Inc. Hub
Bus 001 Device 012: ID 046d:c52b Logitech, Inc. Unifying Receiver
Bus 001 Device 013: ID 4b42:0011 KBDFANS TIGER80
Bus 001 Device 014: ID 0b0e:0e41 GN Netcom Jabra Evolve2 40
Bus 002 Device 001: ID 1d6b:0003 Linux Foundation 3.0 root hub
Bus 002 Device 002: ID 0781:5595 SanDisk Corp.  SanDisk 3.2Gen1
Bus 002 Device 003: ID 0bda:0411 Realtek Semiconductor Corp. Hub
Bus 002 Device 005: ID 05e3:0626 Genesys Logic, Inc. Hub
Bus 003 Device 001: ID 1d6b:0002 Linux Foundation 2.0 root hub
Bus 004 Device 001: ID 1d6b:0003 Linux Foundation 3.0 root hub
Bus 005 Device 001: ID 1d6b:0002 Linux Foundation 2.0 root hub
Bus 006 Device 001: ID 1d6b:0003 Linux Foundation 3.0 root hub
Bus 007 Device 001: ID 1d6b:0002 Linux Foundation 2.0 root hub
Bus 007 Device 002: ID 05e3:0608 Genesys Logic, Inc. Hub
Bus 008 Device 001: ID 1d6b:0003 Linux Foundation 3.0 root hub


// therefore, these are the 2 extra lines: 
Bus 001 Device 004: ID 2109:2211 VIA Labs, Inc. USB2.0 Hub             
Bus 001 Device 007: ID 1462:3fa4 Micro Star International MSI Gaming Controller


// describing them: 

// the gaming controller:
ubuntu@ubuntu:~$ lsusb -v -d 1462:3fa4

Bus 001 Device 007: ID 1462:3fa4 Micro Star International MSI Gaming Controller
Couldn't open device, some information will be missing
Device Descriptor:
  bLength                18
  bDescriptorType         1
  bcdUSB               1.10
  bDeviceClass            0 [unknown]
  bDeviceSubClass         0 [unknown]
  bDeviceProtocol         0 
  bMaxPacketSize0         8
  idVendor           0x1462 Micro Star International
  idProduct          0x3fa4 MSI Gaming Controller
  bcdDevice            0.00
  iManufacturer           1 MS
  iProduct                2 MSI Gaming Controller
  iSerial                 3 A02019010700
  bNumConfigurations      1
  Configuration Descriptor:
    bLength                 9
    bDescriptorType         2
    wTotalLength       0x0029
    bNumInterfaces          1
    bConfigurationValue     1
    iConfiguration          0 
    bmAttributes         0x80
      (Bus Powered)
    MaxPower              100mA
    Interface Descriptor:
      bLength                 9
      bDescriptorType         4
      bInterfaceNumber        0
      bAlternateSetting       0
      bNumEndpoints           2
      bInterfaceClass         3 Human Interface Device
      bInterfaceSubClass      0 [unknown]
      bInterfaceProtocol      0 
      iInterface              0 
        HID Device Descriptor:
          bLength                 9
          bDescriptorType        33
          bcdHID               1.10
          bCountryCode            0 Not supported
          bNumDescriptors         1
          bDescriptorType        34 Report
          wDescriptorLength     117
          Report Descriptors: 
            ** UNAVAILABLE **
      Endpoint Descriptor:
        bLength                 7
        bDescriptorType         5
        bEndpointAddress     0x81  EP 1 IN
        bmAttributes            3
          Transfer Type            Interrupt
          Synch Type               None
          Usage Type               Data
        wMaxPacketSize     0x0040  1x 64 bytes
        bInterval               1
      Endpoint Descriptor:
        bLength                 7
        bDescriptorType         5
        bEndpointAddress     0x02  EP 2 OUT
        bmAttributes            3
          Transfer Type            Interrupt
          Synch Type               None
          Usage Type               Data
        wMaxPacketSize     0x0040  1x 64 bytes
        bInterval               1

// the usb hub: 

Bus 001 Device 023: ID 2109:2211 VIA Labs, Inc. USB2.0 Hub             
Couldn't open device, some information will be missing
Device Descriptor:
  bLength                18
  bDescriptorType         1
  bcdUSB               2.10
  bDeviceClass            9 Hub
  bDeviceSubClass         0 [unknown]
  bDeviceProtocol         2 TT per port
  bMaxPacketSize0        64
  idVendor           0x2109 VIA Labs, Inc.
  idProduct          0x2211 USB2.0 Hub             
  bcdDevice            5.33
  iManufacturer           1 VIA Labs, Inc.         
  iProduct                2 USB2.0 Hub             
  iSerial                 0 
  bNumConfigurations      1
  Configuration Descriptor:
    bLength                 9
    bDescriptorType         2
    wTotalLength       0x0029
    bNumInterfaces          1
    bConfigurationValue     1
    iConfiguration          0 
    bmAttributes         0xe0
      Self Powered
      Remote Wakeup
    MaxPower                0mA
    Interface Descriptor:
      bLength                 9
      bDescriptorType         4
      bInterfaceNumber        0
      bAlternateSetting       0
      bNumEndpoints           1
      bInterfaceClass         9 Hub
      bInterfaceSubClass      0 [unknown]
      bInterfaceProtocol      1 Single TT
      iInterface              0 
      Endpoint Descriptor:
        bLength                 7
        bDescriptorType         5
        bEndpointAddress     0x81  EP 1 IN
        bmAttributes            3
          Transfer Type            Interrupt
          Synch Type               None
          Usage Type               Data
        wMaxPacketSize     0x0001  1x 1 bytes
        bInterval              12
    Interface Descriptor:
      bLength                 9
      bDescriptorType         4
      bInterfaceNumber        0
      bAlternateSetting       1
      bNumEndpoints           1
      bInterfaceClass         9 Hub
      bInterfaceSubClass      0 [unknown]
      bInterfaceProtocol      2 TT per port
      iInterface              0 
      Endpoint Descriptor:
        bLength                 7
        bDescriptorType         5
        bEndpointAddress     0x81  EP 1 IN
        bmAttributes            3
          Transfer Type            Interrupt
          Synch Type               None
          Usage Type               Data
        wMaxPacketSize     0x0001  1x 1 bytes
        bInterval              12
